{
  "$schema": "https://json-schema.org/draft/2020-12/schema",
  "$id": "openmathmodel.contracts.v1.project",
  "title": "Project",
  "description": "一个持续存在的建模项目。领域对象事实来源为 PostgreSQL，本契约描述 API 对外表示。",
  "type": "object",
  "properties": {
    "id": { "$ref": "#/$defs/project_id" },
    "name": { "type": "string", "minLength": 1, "maxLength": 200 },
    "owner": {
      "type": "string",
      "minLength": 1,
      "maxLength": 200,
      "description": "所有者标识。MVP 单用户阶段固定为 local-dev，接入认证后为用户 ID。"
    },
    "mode": {
      "type": "string",
      "enum": ["learning", "collaboration", "auto_experiment", "review", "organization"],
      "description": "产品模式，见规划文档 §1.2。"
    },
    "competition_policy": {
      "type": ["string", "null"],
      "maxLength": 200,
      "description": "CompetitionPolicyProfile 引用 ID；MVP 允许为空。"
    },
    "workspace_uri": {
      "type": ["string", "null"],
      "maxLength": 1000,
      "description": "工作区根 URI（对象存储前缀或本地路径）。"
    },
    "description": { "type": ["string", "null"], "maxLength": 2000 },
    "created_at": { "$ref": "#/$defs/timestamp" },
    "updated_at": { "$ref": "#/$defs/timestamp" },
    "stats": {
      "oneOf": [{ "type": "null" }, { "$ref": "#/$defs/project_stats" }],
      "description": "列表统计投影：仅 GET /v1/projects?include=stats 计算并返回对象，其余端点为 null 或缺省。服务端一次聚合，客户端不再按项目逐个拉取运行与产物。"
    }
  },
  "required": ["id", "name", "owner", "mode", "created_at", "updated_at"],
  "additionalProperties": false,
  "$defs": {
    "project_id": { "type": "string", "pattern": "^proj_[0-9a-f]{32}$" },
    "run_id": { "type": "string", "pattern": "^run_[0-9a-f]{32}$" },
    "timestamp": {
      "type": "string",
      "pattern": "^\\d{4}-\\d{2}-\\d{2}T\\d{2}:\\d{2}:\\d{2}(\\.\\d{1,6})?Z$",
      "description": "UTC ISO-8601，统一以 Z 结尾。"
    },
    "project_stats": {
      "type": "object",
      "properties": {
        "latest_run": {
          "oneOf": [
            { "type": "null" },
            {
              "type": "object",
              "properties": {
                "id": { "$ref": "#/$defs/run_id" },
                "status": {
                  "type": "string",
                  "enum": ["QUEUED", "RUNNING", "WAITING_APPROVAL", "PAUSED", "COMPLETED", "FAILED", "CANCELLED"]
                },
                "current_node": {
                  "type": "string",
                  "pattern": "^[A-Z][A-Z0-9_]*$",
                  "maxLength": 100,
                  "description": "领域阶段节点，随 workflow_version 演进；消费方必须容忍未知节点名。"
                },
                "goal": { "type": "string", "minLength": 1, "maxLength": 4000 },
                "updated_at": { "$ref": "#/$defs/timestamp" }
              },
              "required": ["id", "status", "current_node", "goal", "updated_at"],
              "additionalProperties": false
            }
          ],
          "description": "该项目最新一次运行的轻量投影（按创建时间取最近）；从未发起运行时为 null。"
        },
        "artifact_count": {
          "type": "integer",
          "minimum": 0,
          "description": "项目产物总条数（运行产出与手动上传都计入）。"
        },
        "experiment_count": {
          "type": "integer",
          "minimum": 0,
          "description": "现行实验结果份数：项目全部运行中 EXPERIMENTING 节点的现行阶段输出（stage_outputs.status=current）条数。重做/重试只保留最新版，模拟链路不产出实质内容故不计。可选字段：旧生产者不返回时消费方按「暂无统计」处理。"
        },
        "paper_count": {
          "type": "integer",
          "minimum": 0,
          "description": "现行论文草稿份数：项目全部运行中 PAPER_WRITING 节点的现行阶段输出条数，口径同 experiment_count。可选字段。"
        }
      },
      "required": ["latest_run", "artifact_count"],
      "additionalProperties": false
    }
  }
}
